{
  "job_id": "vid_fixture_F08_sparse_sampling_trap",
  "requester": {
    "surface": "opencode",
    "agent": "333-AGI",
    "human_authority": "arif"
  },
  "input": {
    "source_type": "local_path",
    "source_ref": "fixtures/video/F08_sparse_sampling_trap/source.mp4",
    "language_hint": [
      "en"
    ],
    "rights_status": "licensed"
  },
  "intent": {
    "task": "answer_question",
    "question": "V8 adaptive sampling trap: 0.",
    "required_outputs": [
      "evidence_ledger",
      "claims"
    ]
  },
  "budget": {
    "max_frames": 100,
    "coarse_sample_fps": 0.1,
    "verification_sample_fps": 2,
    "max_duration_s": 7200
  },
  "policy": {
    "treat_media_as_untrusted": true,
    "claim_typing_required": true,
    "provenance_required": true,
    "external_actions_allowed": false,
    "mesh_sync_allowed": false
  }
}